{"$defs":{"LicenseInfo":{"additionalProperties":false,"properties":{"citation":{"anyOf":[{"type":"string"},{"type":"null"}],"default":null,"title":"Citation"},"name":{"minLength":1,"title":"Name","type":"string"},"spdx_id":{"anyOf":[{"type":"string"},{"type":"null"}],"default":null,"title":"Spdx Id"},"url":{"anyOf":[{"format":"uri","maxLength":2083,"minLength":1,"type":"string"},{"type":"null"}],"default":null,"title":"Url"},"usage":{"$ref":"#/$defs/UsagePolicy"}},"required":["name"],"title":"LicenseInfo","type":"object"},"PermissionStatus":{"enum":["allowed","prohibited","restricted","unknown"],"title":"PermissionStatus","type":"string"},"SourceSnapshot":{"additionalProperties":false,"properties":{"accessed_at":{"format":"date-time","title":"Accessed At","type":"string"},"etag":{"anyOf":[{"type":"string"},{"type":"null"}],"default":null,"title":"Etag"},"immutable":{"default":false,"title":"Immutable","type":"boolean"},"last_modified":{"anyOf":[{"type":"string"},{"type":"null"}],"default":null,"title":"Last Modified"},"released_at":{"anyOf":[{"format":"date","type":"string"},{"type":"null"}],"default":null,"title":"Released At"},"version":{"anyOf":[{"type":"string"},{"type":"null"}],"default":null,"title":"Version"}},"required":["accessed_at"],"title":"SourceSnapshot","type":"object"},"UsagePolicy":{"additionalProperties":false,"properties":{"attribution_required":{"anyOf":[{"type":"boolean"},{"type":"null"}],"default":null,"title":"Attribution Required"},"commercial_use":{"$ref":"#/$defs/PermissionStatus","default":"unknown"},"derivative_data":{"$ref":"#/$defs/PermissionStatus","default":"unknown"},"model_training":{"$ref":"#/$defs/PermissionStatus","default":"unknown"},"notes":{"anyOf":[{"type":"string"},{"type":"null"}],"default":null,"title":"Notes"},"redistribution":{"$ref":"#/$defs/PermissionStatus","default":"unknown"}},"title":"UsagePolicy","type":"object"}},"$schema":"https://json-schema.org/draft/2020-12/schema","additionalProperties":false,"properties":{"homepage":{"anyOf":[{"format":"uri","maxLength":2083,"minLength":1,"type":"string"},{"type":"null"}],"default":null,"title":"Homepage"},"license":{"$ref":"#/$defs/LicenseInfo"},"manifest_version":{"const":"0.1.0","default":"0.1.0","title":"Manifest Version","type":"string"},"name":{"minLength":1,"title":"Name","type":"string"},"notes":{"anyOf":[{"type":"string"},{"type":"null"}],"default":null,"title":"Notes"},"owner":{"minLength":1,"title":"Owner","type":"string"},"snapshot":{"$ref":"#/$defs/SourceSnapshot"},"source_id":{"minLength":1,"title":"Source Id","type":"string"},"update_cadence":{"anyOf":[{"type":"string"},{"type":"null"}],"default":null,"title":"Update Cadence"}},"required":["source_id","name","owner","snapshot","license"],"title":"SourceManifest","type":"object","x-rejuv-source-contract-version":"0.1.0"}
